{
  "$schema": "https://json-schema.org/draft/2020-12/schema",
  "$id": "https://personaljarvis.github.io/marketplace/schemas/submission.schema.json",
  "title": "Personal Jarvis Marketplace submission",
  "type": "object",
  "required": ["kind", "name", "publisher", "version"],
  "properties": {
    "kind": { "enum": ["plugin", "skill", "agent"] },
    "name": {
      "type": "string",
      "pattern": "^[a-z0-9](?:[a-z0-9.-]{0,62}[a-z0-9])?$",
      "description": "Agent Plugins v1.0.0 name: 1-64 chars, a-z 0-9 - . only, no '--' or '..'"
    },
    "publisher": {
      "type": "string",
      "pattern": "^[a-zA-Z0-9](?:[a-zA-Z0-9]|-(?=[a-zA-Z0-9])){0,38}$",
      "description": "Your GitHub username — must match the PR author for auto-merge. Display value only; ownership is keyed on publisher_id."
    },
    "publisher_id": {
      "type": "integer",
      "minimum": 1,
      "description": "Your numeric GitHub account id — the immutable ownership key. Logins can be renamed and re-registered by someone else; this number cannot. Required once an entry records one."
    },
    "version": {
      "type": "string",
      "pattern": "^\\d+\\.\\d+\\.\\d+$",
      "description": "SemVer; must strictly increase on updates"
    },
    "plugin_json": {
      "type": "object",
      "description": "kind=plugin: the Agent Plugins v1.0.0 plugin.json, Jarvis specifics under extensions['io.github.personaljarvis']"
    },
    "mcp_json": {
      "type": ["object", "null"],
      "description": "kind=plugin: optional mcp.json with exactly one streamable-http or pinned stdio server; never credentials"
    },
    "skills": {
      "type": "array",
      "maxItems": 10,
      "description": "kind=plugin: skills the package bundles (Agent Plugins skills/). Instructions only — no scripts/, and no risk_policy in the frontmatter.",
      "items": {
        "type": "object",
        "required": ["name", "skill_md"],
        "properties": {
          "name": {
            "type": "string",
            "pattern": "^[a-z0-9](?:[a-z0-9.-]{0,62}[a-z0-9])?$",
            "description": "Becomes a directory under the user's skills folder"
          },
          "skill_md": {
            "type": "string",
            "description": "The complete SKILL.md (YAML frontmatter + instructions)"
          }
        },
        "additionalProperties": false
      }
    },
    "usage_card": {
      "type": ["string", "null"],
      "description": "kind=plugin: optional markdown card (frontmatter 'keywords:' line + guidance prose)"
    },
    "title": { "type": "string", "description": "kind=skill: display title" },
    "description": {
      "type": "string",
      "maxLength": 500,
      "description": "kind=skill: what the skill does"
    },
    "categories": {
      "type": "array",
      "items": { "type": "string" },
      "description": "kind=skill: free-form category tags"
    },
    "skill_md": {
      "type": "string",
      "description": "kind=skill: the complete SKILL.md (YAML frontmatter + instructions)"
    },
    "flavor": {
      "enum": ["jarvis", "portable"],
      "description": "kind=skill: which frontmatter the SKILL.md carries — 'jarvis' uses the app's schema (triggers, execution mode), 'portable' is a plain Agent Skill that also installs into other agents via `npx skills add`. Optional: derived from the file when omitted."
    },
    "compatible_agents": {
      "type": "array",
      "maxItems": 8,
      "items": { "type": "string", "maxLength": 32 },
      "description": "kind=skill: agents you have run this skill in, e.g. ['Claude Code', 'Cursor']. Display only — shown on the store card."
    },
    "agent": {
      "type": "object",
      "description": "kind=agent: the agent template — an allowlist (see README, Submission format). Never accounts, paths, models or permission widenings.",
      "required": ["schema", "name", "instructions"],
      "additionalProperties": false,
      "properties": {
        "schema": { "const": 1 },
        "name": { "type": "string", "minLength": 1, "maxLength": 40 },
        "title": { "type": "string", "maxLength": 120 },
        "instructions": { "type": "string", "description": "Standing instructions (Markdown), at most 20000 bytes" },
        "tier": { "enum": ["specialist", "orchestrator"] },
        "effort": { "type": "string", "pattern": "^[a-z]{0,16}$" },
        "focus": { "type": "array", "items": { "type": "string" }, "maxItems": 60 },
        "grant_mode": { "enum": ["all", "allowlist"] },
        "grants": { "type": "array", "items": { "type": "string" }, "maxItems": 60 },
        "denies": { "type": "array", "items": { "type": "string" }, "maxItems": 60 },
        "skills": { "type": ["array", "null"], "items": { "type": "string" }, "maxItems": 60 },
        "require_approval": { "type": "array", "items": { "type": "string" }, "maxItems": 60 },
        "knowledge_scope": { "enum": ["shared", "own"] },
        "avatar": { "type": "object", "description": "Figure recipe: catalog ids and #rrggbb colours only" }
      }
    }
  },
  "allOf": [
    {
      "if": { "properties": { "kind": { "const": "agent" } } },
      "then": { "required": ["title", "description", "agent"] }
    },
    {
      "if": { "properties": { "kind": { "const": "plugin" } } },
      "then": { "required": ["plugin_json"] }
    },
    {
      "if": { "properties": { "kind": { "const": "skill" } } },
      "then": { "required": ["title", "description", "skill_md"] }
    }
  ]
}
